{
  "id": "kitchen_sink_plugin",
  "name": "Kitchen Sink Plugin",
  "version": "1.1.0",
  "summary": "Reference plugin that exercises daemon and server plugin surfaces with a real Telegram channel and GitHub OAuth.",
  "owner": "arslnb",
  "runtime": [
    "client",
    "server"
  ],
  "categories": [
    "testing",
    "reference"
  ],
  "min_zeus_version": "1.0.0",
  "source_repo": "https://github.com/arslnb/zeus-plugins",
  "license": "MIT"
}
