{
  "id": "email_digest",
  "name": "Email Digest",
  "version": "0.3.0",
  "summary": "Builds a daily inbox digest and sends a summary to your preferred channel.",
  "owner": "arslnb",
  "runtime": [
    "client"
  ],
  "categories": [
    "email",
    "automation"
  ],
  "min_zeus_version": "1.0.0",
  "source_repo": "https://github.com/arslnb/zeus-plugins",
  "license": "MIT"
}
