{
  "id": "gws",
  "name": "Google Workspace",
  "version": "0.1.0",
  "summary": "Google Workspace plugin using gws CLI for Gmail, Drive, and Calendar operations.",
  "owner": "arslnb",
  "runtime": [
    "client",
    "server"
  ],
  "categories": [
    "email",
    "calendar",
    "drive",
    "productivity"
  ],
  "min_zeus_version": "1.0.0",
  "source_repo": "https://github.com/arslnb/zeus-plugins",
  "license": "MIT"
}
